,id,text,category,label
1354,4455,"https://youtu.be/7vdEeo4e524 BUGANDA RISES FROM THE RUINS OF 1966 AS SABASAJJA RETURNS - PART 1 31 July 1993 is supposed to be a major turning point in the history of the ancient kingdom of Buganda. It is on this date that Buganda’s monarch, exiled for nearly a generation, returned to occupy the throne of his illustrious ancestors. For various political reasons, the events leading to this great day have been heavily edited over the years, so much so that the crucial roles played by various actors are hardly recognisable, especially to the Bazzukulu today.Even some of the songs that lauded Buganda’s renaissance in the early 90s have been “edited” to suit another purpose and video footage has suffered equally. Now, OwanaPaedia brings you the first part of the glorious 1993 coronation of Ronald Muwenda Mutebi II, with…just facts. #UgandanHistory #KabakaMutebi #Buganda #Owanapaedia Kindly subscribe to Owanapaedia youtube channel for more historical content. Thank you",Organic,
1355,4456,"#Covid19: #Kenya records 544 more cases; 13 death The Kenya Ministry of Health, said among dead is a nurse, Marian Awuor Adumbo, from Kisii Teaching and Referral Hospital.....read more... http://newz.ug/covid-19-kenya-records-544-more-cases-13-death/",Organic,
1356,4457,"https://youtu.be/7vdEeo4e524 BUGANDA RISES FROM THE RUINS OF 1966 AS SABASAJJA RETURNS - PART 1 31 July 1993 is supposed to be a major turning point in the history of the ancient kingdom of Buganda. It is on this date that Buganda’s monarch, exiled for nearly a generation, returned to occupy the throne of his illustrious ancestors. For various political reasons, the events leading to this great day have been heavily edited over the years, so much so that the crucial roles played by various actors are hardly recognisable, especially to the Bazzukulu today.Even some of the songs that lauded Buganda’s renaissance in the early 90s have been “edited” to suit another purpose and video footage has suffered equally. Now, OwanaPaedia brings you the first part of the glorious 1993 coronation of Ronald Muwenda Mutebi II, with…just facts. #UgandanHistory #KabakaMutebi #Buganda #Owanapaedia Kindly subscribe to Owanapaedia youtube channel for more historical content. Thank you",Organic,
1357,4458,https://youtu.be/v6SGKdgXYwQ,Organic,
1358,4459,"Isolation doesn't translate to an holiday. Your bills actually increase this period. You need a system that can generate income for you while at home or anywhere. How would you feel using this period to learn a high income skill,one you can utilise from the comfort of your home, This is not one of those get rich scheme This is learning to boss the Forex market like a pro, Grab this life changing opportunity as we will be starting this online forex training program on monday 20th of July, 2020 **We will break forex down so beginners can catch up **drop profitable calls **give out different strategies along with PDFs",Organic,
1359,4460,"REMEMBERING FELA ANIKULAPO KUTI, THE BLACK PRESIDENT- RIP Fela died of an Aids-related illness TODAY in 1997, and it seems that every year since then his profile outside Africa has been steadily increasing. Barely a month goes by without new re-releases of his music. Fela’s music – or the Afrobeat genre that he founded – can be heard in lofts in fashionable Dalston in London or Williamsburg in New York, and current popular indie artists like Vampire Weekend, Franz Ferdinand and Damon Albarn have acknowledged a musical debt to him. Albarn has worked with Tony Allen, the original drummer in Fela’s Africa 70, who continues to release albums. Fela’s crossover to a mainstream Western audience was boosted by the musical Fela! which ran in London and Broadway in 2010. And now there’s a feature film – Finding Fela – directed by Academy Award-winner Alex Gibney, which is showing in a few cinemas in the US and rolls out in Europe and beyond in September. As a musician and social activist, he is increasingly being compared with Bob Marley. Since the early 1970s, Fela and his bands Africa 70 and, later, Egypt 80 built up an audience in Nigeria and elsewhere in Africa. People were drawn to the revolutionary politics of his music, with songs like ITT (International Thief Thief), which attacked multinational corporations and Zombie, which parodied the mindless military types who unquestioningly followed orders. In the course of his life he was arrested more than 100 times, imprisoned, tortured and humiliated. Like Bob Marley, he was a man of the people, with a strong political agenda. But it was as a musical revolutionary that he became a talismanic figure for fellow artists. In Gibney’s film, Paul McCartney recounts how he saw Fela’s band when recording Band on the Run at the EMI’s Lagos studio in 1972. “They were the best band I’ve ever seen live” he said. “When Kuti and his band eventually really began to play, after a long, crazy build-up, I couldn’t stop weeping with joy.” FELA was one of the greatest men ever to come out of Africa. He invented a new musical genre and lived life on his own terms, as depicted in an eponymous Broadway which has successfully toured the globe. Bafta-winning director Steve McQueen worked on a film about his life. Fela deserves the attention. He was a giant. Born into a well-to-do family who sent him to the UK to study medicine in 1958, he chose instead to enrol at the Trinity College of Music. After returning to Nigeria in the late 60s, he created Afrobeat, blending African rhythms with jazz and funk. Fela's lyrics were scathing denunciations of Nigeria's socioeconomic reality. He focused on corruption, abuse of power, mental emancipation from colonialism and the need for Nigerians to stand up for their rights. He complained that when a pauper is caught stealing, he is labelled a thief and promptly jailed. But when a minister pockets millions from state coffers, it's explained away with fancy-sounding words to bamboozle the uneducated, like ""mismanagement"" and ""inquiry"". Fela never minced his words when criticising the government, referring to corrupt VIPs by name and christening them ""vagabonds in power"". There were consequences: harassment, imprisonment, beatings. But Fela said this only made him ""stronger"". Audaciously, he declared his sizable compound in Lagos an independent country, “ Kalakuta Republic”, complete with its own constitution and a free health clinic. Kalakuta offered sanctuary to the homeless while students trooped in to take part in debates on Africa's future. Marijuana, a key part of Fela's diet, flowed freely. Kalakuta was a libertarian's dream and a dictator's nightmare. In 1977, a thousand soldiers invaded the micro-republic, beating, raping and killing many of its inhabitants before razing it to the ground. Fela was almost beaten to death while his 77-year-old mother was thrown out of an upstairs window. She died soon after. But this didn't break Fela. After recovering from his injuries, he married 27 women in a single ceremony – saying they were jobless after Kalakuta's destruction so he would take care of them. Fela's marital arrangements and sexual politics continue to draw criticism – the mass wedding was followed by a mass divorce 10 years later, and Kuti often dismissed Aids and contraceptive protection as ""un-African"" – but at the time many Nigerians were enthralled by Fela's defiance. He went on to establish a political party, continued to lambast the authorities and suffered beatings and imprisonment. In 1979 he ran for presidency, but the military torpedoed his candidacy. Fela also criticised his countrymen for what he saw as their exaggerated reverence for authority and cowardice. ""My people are scared of the air around them, they always have an excuse not to fight for freedom,"" he sang. When men live in a system that does not even try to camouflage its injustice, they react by becoming radical or (truncated)",Organic,
1360,4461,https://youtu.be/RoFHv62ICj4,Organic,
1361,4462,Butembe here we're #NATIONALunityPlatform #PeoplePower_OurPower,Organic,
1362,4463,"I AM PREPARED TO TALK TO THE DEVIL IF IT WILL HELP BRING PEACE TO NORTHERN IRELAND - JOHN HUME, CONSIDERED THE GREATEST PEACE MAKER OF THE 20TH CENTURY. RIP.",Organic,
1363,4464,Like page,Organic,
1364,4465,Renewable energy deployment and financing is necessary for Uganda #MonitorUpdates,Editorial,
1365,4468,TTAABA AVUNDIRA MU NJU: Abalimi beekubidde enduulu e Kakumiro #NTVNews,Editorial,
1366,4469,"OKUZZAAYO FFOOMU MU NRM: Kwa kukolebwa mu bitundu, batandika na bugwanjuba #NTVNews",Editorial,
1367,4470,This guy can manage Uganda's opposition better than M7🤔,Organic,
1368,4471,NUP EYONGEDDE OKUGGUMIRA: Ababaka bataano ne bameeya bana bagyegasseeko #NTVNews,Editorial,
1369,4472,Like page,Organic,
1370,4473,NNAMBA Y’ABABAKA: Ku luno omuwi w’omusolo ali ku kasandali #NTVNews,Editorial,
1371,4474,OKUKWASISA EBIRAGIRO BY’AKALULU: Poliisi etaddewo akabinja akapya #NTVNews,Editorial,
1372,4475,"**""I Must Marry The Woman Of My Dreams Before Celebrating New Year's Eve."" Diamond Platnumz Fools Himself.**",Organic,
1373,4476,Boda bodas are a part of our lives #MonitorUpdates,Editorial,
1374,4477,OKUKWATIRA FDC BENDERA: Ennaku zongezeddwayo eri abaagala ekya pulezidenti #NTVNews,Editorial,
1375,4478,NTV Power of Legacy | www.ntv.co.ug:=:https://www.ntv.co.ug/,Editorial,
1376,4479,OKUBOOGA KW’ENNYANJA ALBERT: Obukama bwa Bunyoro ssibusanyufu n’enkola ya Gav’t #NTVNews,Editorial,
1377,4480,SSENTE Z’ABAAKOSEBWA COVID-19: Ez’abasomesa zongezeddwa okutuuka ku buwumbi 22 #NTVNews,Editorial,
1378,4481,"Why the craze for districts, counties? #MonitorUpdates",Editorial,
1379,4482,Like our page for more interesting pieces,Organic,
1380,4483,https://youtu.be/LnH76l7mhZQ,Organic,
1381,4484,School owners draw lessons from lockdown #MonitorUpdates,Editorial,
1382,4485,Struggling Victoria University Reduces Tuition For All Courses by Half,Organic,
1383,4486,"Wooww LOOK .. .. chicago baby what a big surprise - Look ... Look ... Oklahoma Highway Patrol Performed Pit On Pursuit Vehicle, But Watch What Happens #amazingvideos",Organic,
1384,4487,https://youtu.be/8w239L3-_ik,Organic,
1385,4488,"The easiest way to earn Bitcoins? Just change your browser to CryptoTab and receive payments to your balance every 10 minutes. You will get BTC for simply using it, even if just having CryptoTab browser window open. It takes less than 1 minute to start earning -",Organic,
1386,4489,https://youtu.be/ofihKeEwHg4,Organic,
1387,4490,"JOHN HUME, CONSIDERED THE GREATEST PEACE MAKER OF THE 20TH CENTURY, SADLY PASSED AWAY TODAY, AGED 83. RIP.",Organic,
1388,4491,"Basajja Mivule Prophesied his own arrest by the government, this video clip is the one that landed him to trouble. Watch, Share and Subscribe",Organic,
1389,4492,The changing face of Kampala City roads #MonitorUpdates,Editorial,
1390,4493,"Covid 19, so real",Organic,
1391,4494,ELECTION WATCH (ICYMI): NRM youth decry elders' overstay in power. #MorningAtNTV #NTVNews Watch 👇👇,Editorial,
1392,4495,"Barack Obama under vicious attack by his half-brother Malik Obama. The vindictive half brother is angry Barack never made him rich, whereas siblings of all Kenyan presidents are dollar millionaires.",Organic,
1393,4496,Create land ombudsman to end evictions - inquiry team #MonitorUpdates,Editorial,
1394,4497,"Meaning Bobi Wine and his Group don't want State House, they want to lead opposition and have Leader of Opposition in Parlianment like how Dr. Abed Bwanika and Odonga Otto have been complaining about FDC Chosing LOP and Accontability Committes in Parlianment.",Organic,
1395,4498,I have FINALLY overcome my fear of bleach and bleached my hair from black to blonde. A MONEY GIVEAWAY is also included so Watch full video to take part and WIN!!!,Promotional,
1396,4499,The same promises but still no change! We got a raw deal Ugandans! Time for actual Financial Liberation with #PresidentJosephKabuleta!,Organic,
1397,4500,Karamoja artisanal miners bite the dust over Covid-19 #MonitorUpdates,Editorial,
1398,4501,i-found-out-my-husband-had-a-baby-outside-our-marriage-through-social-media/,Organic,
1399,4502,DEMONS SLEEP WITH PEOPLE - TRUMP'S MEDICAL ADVISOR. FAO Sokolokobangusay Kolongo Teddy Ayo William Okidi,Organic,
1400,4503,Mutebile why not resign?,Organic,
1401,4504,TAKE NOTE: How women can we win in the COVID-19 era. #MorningAtNTV #NTVNews Click 👇👇,Editorial,
1402,4505,Covid deaths: What govt should do to avert crisis #MonitorUpdates,Editorial,
1403,4506,The time for a Financial Liberation is now. We do not want another 5years of the same old shit! #PresidentJosephKabuleta,Organic,
1404,4507,The time for a Financial Liberation is now. We do not want another 5years of the same old shit! #PresidentJosephKabuleta,Organic,
1405,4508,Govt sets conditions for reopening airport #MonitorUpdates,Editorial,
1406,4509,https://youtu.be/9ytCdOOqY0c,Organic,
1407,4510,TV presenter narrates arrest ordeal by CID #MonitorUpdates,Editorial,
1408,4511,"Sixteen-year-old Linnet covers her face bashfully, mumbling into her hands as she recounts how she met the young man who bought her fries and gave her money, before leaving her pregnant and facing even greater poverty than before. #NTVNews Full report here 👇👇",Editorial,
1409,4512,😡😡!!!!,Organic,
1410,4513,😡😡!!!!,Organic,
1411,4514,New cities challenged in court #MonitorUpdates,Editorial,
1412,4515,I think it is not a matter of speaking up but to evolve measures by which they can observe SOPs.,Organic,
1413,4516,ELECTION WATCH: Capt Mukula's opponent cries foul over alleged racial discrimination ahead of primaries face off. #MorningAtNTV #NTVNews Full story here 👇👇,Editorial,
1414,4517,BoU sets parameters to drive cashless economy #MonitorUpdates,Editorial,
1415,4518,Like the page and share,Organic,
1416,4519,UETCL memo links power blackouts to shoddy work #MonitorUpdates,Editorial,
1417,4520,"*💫 #PhanerooGlobalSOM2020 Live stream 🌍* ```📡 Stream Phaneroo Live``` *💻 Phaneroo YouTube Channel:* https://www.youtube.com/c/phaneroo/live *💻 Livestream Website:* https://livestream.com/phaneroo *🖥️Phaneroo TV*: http://live.Phaneroo.org *📱Facebook Livestream:* https://www.facebook.com/phanerookampala/live/ *📺Spirit TV:* Free-to-Air decorders, GoTV Channel 834 & StarTimes Channel 291 *📺LTV:* Free-to-Air decorders & GoTV Channel 836 *🎧Phaneroo Radio:* https://phaneroo.org/radio/ *📱Livestream App* _iOS:_ https://itunes.apple.com/us/app/livestream/id493086499?mt=8 _Android:_ https://play.google.com/store/apps/details?id=com.livestream.livestream 🗓 Day: *3rd August 2020* 🕓 Time: *3pm - 6pm EAT* 🇺🇬 Place: *Online.* *#PhanerooGlobalSOM2020* *#PhanerooOnlineService* *Phaneroo ~ Make Manifest*",Organic,
1418,4521,Vanilla farmers suffer losses as prices drop #MonitorUpdates,Editorial,
1419,4522,The Acting Chairperson Electoral Commission of the FDC Party has announced the postponement of the nomination of their presidential candidates due to lack of clear guidelines from the National Electoral Commission. #NTVNews,Editorial,
1420,4523,"Govt orders UWA to surrender 8,000 hectares to Kween locals #MonitorUpdates",Editorial,
1421,4524,This was so unusual of Mr.Bskireke!,Organic,
1422,4525,"Civil Education to enlighten you on the Uganda Constitution that you should know TRIED NY BEST TRANSLATE FOR NON-LUGANDA SPEAKING: Civic Education you need to be enlightened. Uganda has had 4 constitutions. The first was in 1962 and we know it had some problems. This lead to the amended one of 1967 called the ""Pigeon Hole"" by Pres. Milton Obote. In 1971 came Pres. Amin who put a legal notice #1 which removed the constitution of 1967 and instituted his. ""Legal Notice"" is a letter that amends some articles in the constitution and adds that one wants but the people or citizens requesting or discussing. It's an individual's proposal or discussion nit citizens proposals or discussion and put it the legal notice and it comes law or becomes pat of the constitution. However, there were those that came with Pres. Lule coming from Tanzania. With him were Mr. Binaisa, and others also made an instrument of ""Legal Notice"" of 1970 remove one for 1971 and also removing one one for 1967. At that time there are some youth who noticed what the elders were doing at that tine and they copied. In the end, entered Luwero and entered the bush to restore the constitution and democracy. There were some youths who saw what the elder are doing and went to the bush in 1981 and won in 1986 and they brought brought ""Legal Notice"" of their own which said that the constitution of 1976 is illegal and placed a hold on the constitution of 1967 instituting an Electoral Commission which was like an electoral commission investigating the constitution of Pres. Milton Obote to see what needed to be amended in it. In the ""Legal Notice"" that Mr. Museveni instituted removed some articles like freedom of association, added Supreme Law of the Land is the President because there was no constitution All powera if the constitution of 1967 given to the President given to him for the next 4 years a period promising while the Electoral Comission investigated what needed to be amended. This was to restore the constitution and democracy. After 4 years the Commissions was not able to.do it's job and extended another 4 years which was his thing of extensions and lockdown. Then reaching 1994, in the Constitution Assembly came up with the fourth constitution of Uganda of 1995 and on the yeat on September 22nd is the date of that constitution although it went into law on October 8th, one day prior to independence day. When you look at a whole the problems that have brought wars, chaos originated from the fact that everyone wants to manipulate the constitution by force and the individuals assume the authority to ammends the constitution with the gun. The 1995 constitution current in force has its power given by the people and its that power that enforces government to run the affairs of the people by law or legally. It's the constitution that governs us. The constitution and i will call it the original constitution says if there is any one that tries to change the constitution commits treason. It continues to say that as a Ugandan you have to fight for.the constitution because if you do fight foe it that ""Power"" or authority can be take away from you by another in power and yet the power should have been yours through the vote. Nobody gave us that power except we the citizens and that led to the first elections in 1996 done after that constitution was enforced. In that constitution there were two important articles. The first one was based of past issues instituted term limits and secondly age limit ti prevent repeating the past mistakes and mean we have given ourselves the constitution and starting afresh in peace a New Uganda. In 2005, the leader himself who went in the bush to restore democracy and articles by touching the constitution or removing the term limits and people protest; however then ended up removing the term limits and we enterednintonthe next elections. However, there was an article that people though would withstand of age limit and people protested and still they removed this article as well. Now we are going in the scientific election. Before forget, we had TDA. Opposition put themselves in a group in the last elections of 2016. In which they places some conditions that if not met would not participate in the next coming elections. These conditions were not met and still the Opposition participated in the elections. Now this is happened again, the president has announced we are having a scientific election and the opposition is protesting but yet standing up candidates. There is a way the opposition connects in that when one does something everyone else follows or copies. In the process they find themselves whatever they are opposed to doing is the same they are doing. Because if you are opposed to doing something you can't be the same person participating in what you are opposed to means you agree with what's being done. The original construction of 1995 says ""you cannot change"" that anyone who changes the constitution commits (truncated)",Organic,
1423,4526,PWJK (ICYMI): Jaundice and cerebral palsy; a mother's tale. #PWJK Full show here 👇👇,Organic,
1424,4527,https://youtu.be/TVd6Zwwvlp8,Organic,
1425,4528,Problems with logistics resulted in delays in voting for FDC candidates for various positions in Kasese district. #NTVNews,Editorial,
1426,4529,The leadership in the new city of Fort Portal has embarked on the renovation of old colonial structures to give meaning to the acquired status. #NTVNews,Editorial,
1427,4530,"If I were this man I would start laughing and say ""I was joking sweetheart""",Organic,
1428,4531,[18+]Viewer discretion advised: Lady undergoes surgery to remove huge dildo structure in her womanhood after it got stuck [Watch],Organic,
1429,4532,"LACKING BASIC NEEDS , the Vulnerable people are always Deprived to Social Economic 15yaer old PAUL TUMUSIMA elder brother to NAMUKOBE SUSAN 8years narrating the full story of the Struggle & Pain he and his siblings they go through to Survive for a living",Organic,
1430,4533,"With all due respect Mr Bobi wine...your judgement has been questionable of who to bring close to you.. you failed to see through ashburg even when tom Voltaire warned you...this guy faked his kidnap and always targeted besigye instead of NRM. You kept quiet and now he came for you.. you brought bwanika close to you even when besigye warned you.. you brought muntu close to you even when they warned you...to muntu you were supposed to remain as MP and help with his presidential bid...NRM prefers muntu to take over, you chose kassiano wadri even when he attended NRM caucases. I'm not saying Rubongoya is questionable but come on, the guy had access to museveni.. undercover cops even take drugs to catch the drug dealers... You should listen when people warn you...byebyange",Organic,
1431,4534,"With all due respect Mr Bobi wine...your judgement has been questionable of who to bring close to you.. you failed to see through ashburg even when tom Voltaire warned you...this guy faked his kidnap and always targeted besigye instead of NRM. You kept quiet and now he came for you.. you brought bwanika close to you even when besigye warned you.. you brought muntu close to you even when they warned you...to muntu you were supposed to remain as MP and help with his presidential bid...NRM prefers muntu to take over, you chose kassiano wadri even when he attended NRM caucases. I'm not saying Rubongoya is questionable but come on, the guy had access to museveni.. undercover cops even take drugs to catch the drug dealers... You should listen when people warn you...byebyange",Organic,
1432,4535,Several MPs including John Baptist Nambeshe and Latif Sebaggala have joined the National Unity Platform (NUP) ahead of the 2021 elections. #NTVNews,Editorial,
1433,4536,**Rema Namakula Confirms Pregnancy Rumors After Sharing Her Baby Bump Revealing Eid Photos With Bonk-mate Hamza Ssebunya**,Organic,
1434,4537,Hit,Organic,
1435,4538,E,Organic,
1436,4539,Y,Organic,
1437,4540,"Vote them out! NRM leaders can not cause change, FDC Aspirant",Promotional,
1438,4541,T,Organic,
1439,4542,"Dear friends, please vote for my sister by liking and sharing this video. Thanks.",Organic,
1440,4543,See what they call being represented👍,Organic,
1441,4544,"Carry your work with you to our dining space, and feast while enjoying our steady internet speeds. Come and dine with us today at Plot 14 Lower Kololo Terrace Rd, See our full menu here: www.tamaraiug.com. Order on phone 0755794958. You can also find us at #JumiaFood. #Tamarai #Tamaraifood #Foodie #Foodporn #Ordernow #Safedelivery #Instafood #lunchtime",Promotional,
1442,4545,Boxing 256,Organic,
1443,4546,trumpet,Organic,
1444,4547,"**Digital Marketer and Affiliate marketers** especially those under **COVID 19** Lock down, this is for you. DM for more details Just click the link bellow and have a look. You will thank me later. [http://30daysto1000.com/cp4.php?user=bahene](http://30daysto1000.com/cp4.php?user=bahene&fbclid=IwAR32-h9E3kk1P6dRPcNEP8kdJbO8FE25JUE6vKKzjiNUP6FRvGuftDU--oI)",Organic,
1445,4548,massage,Organic,
1446,4549,Angelish Religion...new one,Organic,
1447,4550,"Uganda electoral commissioner warned Bobi wine against using red colour,said the colour belong to UPC. >>>>>>",Organic,
1448,4551,Be enlighten about Uganda's civic education. UGANDANS WAKE UP!!!,Organic,
1449,4552,"America's first crewed spaceship to fly to the International Space Station in nearly a decade returned safely to Earth on Sunday, splashing down in the Gulf of Mexico. #NTVNews Full story here 👇👇",Editorial,
1450,4553,"O4 MPs officially join #BobiWine’s #NationalUnityParty MPs John-Baptist Nambeshe, Patrick Nsamba, David Kalwanga and Francis Zzaake and Latif Ssebagala officially unveiled as members of National Unity Platform",Organic,
1451,4554,"NTV SPORT: As Motocross prepares to return to the racing track, parent riders and marshalls have been trained in giving first aid to the riders. #NTVNews 👇👇",Editorial,
