,id,text,category,label
2585,5681,Can Rwomushana build Bobi Wine’s ‘deep opposition’? https://zionly.io/WaQRsSD:=:https://www.monitor.co.ug/OpEd/columnists/AllanTacca/Can-Rwomushana-build-Bobi-Wine-s--deep-opposition--/878694-5599456-ilydfn/index.html #MonitorUpdates,Editorial,
2586,5682,I RESPECT MY OPINION WHENEVER I LOOK BACK Is MAO heading DP to a crush? This is the Democratic Party NEC 1 Chaiman Kezala Muhammed 2 Vice Chairman Wamala 3 President H.E Nobert Moa 4 Vice President H.E Mukasa Mbide (N.R.M) 5 Secretary Gen Hon Matia Nsubuga (R I.P) 6 Deputy S.G Hon Silanda Gerald 7 Tresurer Hon Isa kikungwe (R I.P) 8 Legal Advisor Samuel Muyizi kayayu 9 Publicity Sec Keneth Paul kakande 10 Deputy publicity Waiswa Mufumbiro (NUP) 11 Youth Leader Okidi Christopher 12 DP Youth Leader Paul ssembajjwe (NUP) 13 Youth Sec Nakyanzi Ritah Daizy 14 Organising Sec kidandala sulaiman (NUP) 15 Woman leader hon Namayanja 16 Deputy woman hon Namaganda. 17 Vice central Region hon Nambooze 18 Vice western Imam Makumbi 19 Vice Eastern Hon Mutembule (NUP) 20 Vice nothern Lyanda Komacech,Organic,
2587,5683,We need oversight mechanisms for Covid-19 guidelines https://zionly.io/OW180OV:=:https://www.monitor.co.ug/OpEd/Commentary/We-need-oversight-mechanisms-for-Covid-19-guidelines/689364-5599404-2e7q1i/index.html #MonitorUpdates,Editorial,
2588,5684,Why Africa ????,Organic,
2589,5685,Covid-19: The Judiciary and joke of election petitions in Uganda https://zionly.io/mvPsCWF:=:https://www.monitor.co.ug/OpEd/Commentary/Covid-19--The-Judiciary-and-joke-of-election-petitions-in-Uganda/689364-5599390-85gsq3/index.html #MonitorUpdates,Editorial,
2590,5686,NSSF esasudde eyali ayagala okufuna obujjanjabi #NTVNews,Editorial,
2591,5687,Pr. Wilson Bugembe live in service with MC Kats and Douglas Lwanga. Enjoy the morning blessing,Organic,
2592,5688,Stella Nyanzi: unifier or splitter? https://zionly.io/nzg9jfW:=:https://www.monitor.co.ug/OpEd/Commentary/Stella-Nyanzi--unifier-or-splitter-/689364-5599424-c9jbq0z/index.html #MonitorUpdates,Editorial,
2593,5689,BOOKEZZA PIKIPIKI YA POLIISI: Ab’e Kyengera beekyaye lwa kabenje #NTVNews,Editorial,
2594,5690,ENKAMBI YE KYANGWALI: Gav’t egenda kuddamu okutematema ettaka #NTVNews,Editorial,
2595,5691,Rebel MPs and tragedy of Uganda politics https://zionly.io/69Chfz2:=:https://www.monitor.co.ug/OpEd/Commentary/Rebel-MPs-and-tragedy-of-Uganda-politics/689364-5599398-u50hx7/index.html #MonitorUpdates,Editorial,
2596,5692,OMG !!! Neither one needs to drive. I don't know what they're on but God knows I don't want it. Please don't let them drive.,Organic,
2597,5693,Too many elections and not enough social service delivery https://zionly.io/qhJ0Dv9:=:https://www.monitor.co.ug/OpEd/Commentary/Too-many-elections-and-not-enough-social-service-delivery/689364-5599410-1011938/index.html #MonitorUpdates,Editorial,
2598,5694,Namilyango pocket money: A tale of the Mwiri and Ntare presidencies https://zionly.io/DN65P08:=:https://www.monitor.co.ug/OpEd/Commentary/Namilyango-pocket-money-tale--Mwiri-Ntare-presidencies/689364-5599414-cyfitk/index.html #MonitorUpdates,Editorial,
2599,5727,Ways to invest in real estate https://zionly.io/aLVqufF:=:https://www.monitor.co.ug/Business/Ways-to-invest-in-real-estate/688322-5599374-1lnmpu/index.html #MonitorUpdates,Editorial,
2600,5695,"WELCOME TO THE LEGAL JUNGLE OF PEOPLE POWER MISSION 2021 REVOLUTION: The Time For The Bush War Memories In The New Uganda Is Over. Yoweri Museveni And His ""National Robbery Movement"" Should Pack Their Belongings And Leave In Peace After 40 Years In Power Or They Will Leave By Force In Pieces. IT'S THE END GAME. IT'S A DO OR DIE GRAND FINALE. https://www.facebook.com/merryheartcomidy/videos/1255952264747056/",Organic,
2601,5696,Oops! Look what the geeks did again https://zionly.io/nhOYp6C:=:https://www.monitor.co.ug/OpEd/Commentary/Oops--Look-what-the-geeks-did-again/689364-5599440-13q3t4xz/index.html #MonitorUpdates,Editorial,
2602,5697,"SOUTH AFRICA EYOOKYA, OMUGAGGA DON ABOTODE EBYAMA BITISA",Organic,
2603,5698,Thank you 🙏,Organic,
2604,5699,ARE CROWS MORE LOYAL AND RESPONSIBLE THAN HOMO SAPIENS?,Organic,
2605,5700,Please Subscribe to her YouTube Channel👇❤ https://www.youtube.com/channel/UCkdKXaAgJs_hqiYTFxT51WQ,Organic,
2606,5701,Please Subscribe to her YouTube Channel👇❤ https://www.youtube.com/channel/UCkdKXaAgJs_hqiYTFxT51WQ,Promotional,
2607,5702,OMG!!! Is it overuse power?,Organic,
2608,5703,We may not all do great things but we can do small things with love - #MotherTeresa - Lend a hand. With a donation as little as 1000/= (Mobile Money) we can make it happened. Join us donate whatever you can today so we can reach the set target.,Organic,
2609,5704,#UgVotes2021,Organic,
2610,5705,Details: https://bit.ly/2VzN8UW | Deadline: Sept 1 Danish Government Scholarship for International Students at the University of Southern Denmark (Fully Funded) University of Southern Denmark offers the Danish Government Scholarship supported by the Ministry of Higher Education and Science,Organic,
2611,5706,VERY POWERFUL MEESSAGE FROM THE MAN OF GOD FOR THE LIKES OF DICTATOR MUSEVENI AND ALL HIS EVIL-HEARTED KILLER GANGS THANK YOU,Organic,
2612,5707,The ministry of health has confirmed the country’s second COVID-19 death. #NTVNews,Editorial,
2613,5708,Arrival of Prophet Elvis Mbonye at kololo on his honor ceremony 2017 (1st September),Organic,
2614,5709,Let it take u thru,Organic,
2615,5710,https://youtu.be/PSQMT_UBxGo please subscribe for more movies,Promotional,
2616,5711,Hoteliers and tour operators in Uganda want a 40% deduction tariffs for Utilities. #NTVNews,Editorial,
2617,5712,Londa Latif,Organic,
2618,5713,"The first deputy prime minister general Moses Ali has appealed to locals in Kyangwali sub-county Kikuube district, one of the refugee hosting districts in the country, to embrace government land resettlement exercise. #NTVNews",Editorial,
2619,5714,Otunda kaboozi oba ogula kaboozi? Join the right WhatsApp market group. ATUNDA AYOLESA.........,Organic,
2620,5715,"this is mbarara, hope Joel Ssenyonyi, u copy this",Organic,
2621,5716,"Twenty years later, Misaki Syahuka Bwambale still lives on https://bit.ly/3jL0JU2:=:https://www.monitor.co.ug/Magazines/Life/Twenty-years-Misaki-Syahuka-Bwambale-Kasese-Katwe-salt-/689856-5599186-78e8d2/index.html #MonitorUpdates",Editorial,
2622,5717,Mistakes people make in retirement https://bit.ly/39tbhCk:=:https://www.monitor.co.ug/Magazines/Life/Mistakes-people-make-land-business-house-credit-retirement/689856-5599194-k3klvk/index.html #MonitorUpdates,Editorial,
2623,5718,Come let us build a new Bible House https://bit.ly/2CF64eR:=:https://www.monitor.co.ug/Magazines/Life/-build-Bible-House-Holy-Scriptures-Babylonian-Jerusalem/689856-5599198-okc0tc/index.html #MonitorUpdates,Editorial,
2624,5719,https://youtu.be/FItAYRzaBiU,Organic,
2625,5720,Dont miss out on a lot of the tour find out what we have ... Contact us today,Organic,
2626,5721,"There are some words that have been edited out which in my opinion,took out a very important message! Lujjuliro why?",Organic,
2627,5722,The lack of a coherent strategy and failure of the Lord Mayor to work with the central government have been cited as some of the hindrances to effective service delivery in Kampala #NTVNews,Editorial,
2628,5723,Omwana wuyoo,Organic,
2629,5724,My God ohhhh!! 😭😭😭😭 This life is something else! 😭😭😭 You can’t even trust your own family again in this country 😭😭😭😭 All because of jealous and wickedness and anger by the step mum 😭😭😭😭😭 He’s in the hospital now but he’s not responding to treatment. Please I’m begging you pray for this boy abeg! Please a comment of quick recovery will go a long way in making God consider giving this child a second chance 😭😭😭😭😭,Organic,
2630,5725,"#Covid19: #Kenya records 960 cases as #Uganda records second death Kenya has recorded 960 new coronavirus cases pushing the country’s total caseload so far to 17,603. At the same time, more patients succumbed to the disease, raising the number of fatalities to 280....read more,,,, http://newz.ug/covid-19-kenya-records-960-cases-as-uganda-records-second-death/",Organic,
2631,5726,St Kizito Waluleta pilgrimage cancelled over coronavirus https://bit.ly/3hHn7f7:=:https://www.monitor.co.ug/News/National/St-Kizito-Waluleta-pilgrimage-cancelled-coronavirus-Luweero/688334-5599430-yq60lb/index.html #MonitorUpdates,Editorial,
2632,5788,Guy's just prepare your selfMbazira Elisha today,Organic,
2633,5728,"A month after the story first run on NTV, NSSF has paid out Richard Kalema's benefits. Kalema, a resident of Kagadi, received ten million shillings after the pension fund sought a second opinion from a doctor on his medical condition. #NTVNews",Editorial,
2634,5729,Voice ofUgandaradio,Organic,
2635,5730,Mbabazi Sharon gave birth. Watch her latest story now,Organic,
2636,5731,The taxi journey that changed her life https://zionly.io/FBmVWyw:=:https://www.monitor.co.ug/Business/The-taxi-journey-that-changed-her-life/688322-5599354-i3s94fz/index.html #MonitorUpdates,Editorial,
2637,5732,"A rewind in episode thus 6 he put it wright I quote ""DON'T FEAR THE ONE WHO KILLS THE BODY, BUT FEAR THE ONE WHO KILLS THE BODY AND THE SOUL"" GLORY BE TO THE LORD in #ugandaisamovie CREDIT; Basajjamivule Official #ugandapolice",Organic,
2638,5733,"#BenjaminMkapa died of a heart attack, not #Covid19- family Questions arose over Mkapa's cause of death after Magufuli did not immediately make an official announcement on the time, place and cause in ...read more... http://newz.ug/benjamin-mkapa-died-of-a-heart-attack-not-covid-19-family/",Organic,
2639,5734,"WELCOME TO THE LEGAL JUNGLE OF PEOPLE POWER MISSION 2021 REVOLUTION: The Time For The Bush War Memories In The New Uganda Is Over. Yoweri Museveni And His ""National Robbery Movement"" Should Pack Their Belongings And Leave In Peace After 40 Years In Power Or They Will Leave By Force In Pieces. IT'S THE END GAME. IT'S A DO OR DIE GRAND FINALE.",Organic,
2640,5735,Who will steal the vaccine? https://bit.ly/338G7PJ:=:https://www.monitor.co.ug/Magazines/Life/steal-vaccine-Covid19-WHO-Paris-Conference/689856-5599190-ibwbmsz/index.html #MonitorUpdates,Editorial,
2641,5736,"mi amigo ha compartido esta publicación y él gana, compártela ahora",Organic,
2642,5737,Ssabalabirizi w'ekkanisa ya Uganda Dr. Stephen Kazimba Mugalu atendereza obukulemebze bwa Ssabasajja Kabaka Muwenda Mutebi obujudde enkulakulana nokuzimba obumu mu Buganda mu myaka abbiri mwomusanvu nga atudde kunamulondo #NTVNews,Editorial,
2643,5738,Eddy Sendi is my Mr Fix It – Benon https://bit.ly/3jFgFqL:=:https://www.monitor.co.ug/Magazines/Life/Eddy-Sendi-Mr-Fix-It-Benon-Kibuuka-Kampala-Cubs-Katumba/689856-5599182-15mleexz/index.html #MonitorUpdates,Editorial,
2644,5739,Education opened doors to my future – Diana Nyago https://bit.ly/332Fgj8:=:https://www.monitor.co.ug/Magazines/Life/Education-doors-future-Diana-Nyago-learners-Buikwe/689856-5599176-12dq3usz/index.html #MonitorUpdates,Editorial,
2645,5740,NSSF esasudde eyali ayagala okufuna obujjanjabi #NTVNews,Editorial,
2646,5741,"Some musings on People Power, FDC and other political groups https://zionly.io/iPuJyeA:=:https://www.monitor.co.ug/OpEd/columnists/BernardTabaire/Some-musings-on-People-Power--FDC-and-other-political-groups/878688-5599444-652wcwz/index.html #MonitorUpdates",Editorial,
2647,5742,Relationships & Marriage issues with Pr. Peter and Janat Kyambadde,Organic,
2648,5743,S8+,Organic,
2649,5744,BOOKEZZA PIKIPIKI YA POLIISI: Ab’e Kyengera beekyaye lwa kabenje #NTVNews,Editorial,
2650,5745,"Uganda: Mr Museveni vowed to arrest and torture any Ugandan who dares to highlight the issue of his endemic corruption, nepotism, sectarianism, and tribalism in Uganda. Museveni free Uganda's prominent artist (singer) Gerald Kiweewa and five Radio Simba presenters/ artists known as Bizonto.",Organic,
2651,5746,"WELCOME TO THE LEGAL JUNGLE OF PEOPLE POWER MISSION 2021 REVOLUTION: The Time For The Bush War Memories In The New Uganda Is Over. Yoweri Museveni And His ""National Robbery Movement"" Should Pack Their Belongings And Leave In Peace After 40 Years In Power Or They Will Leave By Force In Pieces. WOW - UGANDANS SHOULD WAKE UP AND KNOW WHERE THE COUNTRY IS HEADED UNDER M7 AND HIS NRM? ACTUALLY, IN THE FUTURE, UGANDANS WILL BE REQUIRED TO APPLY FOR A PERMIT TO MOVE OUT OF THEIR DISTRICT FOR BUSINESS OR PLEASURE? IT'S THE END GAME. IT'S A DO OR DIE GRAND FINALE.",Organic,
2652,5747,ENKAMBI YE KYANGWALI: Gav’t egenda kuddamu okutematema ettaka #NTVNews,Editorial,
2653,5748,ON AIR: Perspective with Josephine Karungi www.ntv.co.ug:=:https://www.ntv.co.ug/,Editorial,
2654,5749,"https://youtu.be/5PLqTaxjh0Y Guys! I've just uploaded a new video, please go and watch + there's some WINNERS from my previous MONEY GIVEAWAY video 😊",Organic,
2655,5750,"Minisita w’ebyamawulire n’okulungamya eggwanga Judith Nabakooba, asabye bannakatemba n'abayimbi abalina okwemulugunya ku tteeka epya erireetebwa gavumenti okutuukirira minisitule ye #NTVNews",Editorial,
2656,5751,UCAA sets terms for resumption of flights https://bit.ly/3g4fuyN:=:https://www.monitor.co.ug/News/National/UCAA-terms-resumption-flights-UTB-Covid19-Bamwesigye/688334-5599372-i7w28t/index.html #MonitorUpdates,Editorial,
2657,5752,Why African judges criticized Zimbabwe Chief Justice Malaba https://zionly.io/jrVBOsH:=:https://www.monitor.co.ug/Magazines/PeoplePower/Why-African-judges-criticized-Zimbabwe-Chief-Justice-Malaba/689844-5599328-whc12xz/index.html #MonitorUpdates,Editorial,
2658,5753,"Point blank, like and follow",Promotional,
2659,5754,Interesting Uganda!,Organic,
2660,5755,"I must confess that I am not familiar with Uganda’s Penal Code. However I cannot help but wonder under what section of the law the Bizonto actors are going to be charged. When this case comes up for trial, the real perpetrators of tribalism will in reality be the ones on trial. I weep for the prosecutor and judge upon whom this tragic comedy is going to be thrust.",Organic,
2661,5789,Are you a toxic person?,Organic,
2662,5756,Be your own guest https://bit.ly/302pOBT:=:https://www.monitor.co.ug/Magazines/Life/-own-guest-Coronavirus-Easter-Christmas-wedding/689856-5599204-qnyykx/index.html #MonitorUpdates,Editorial,
2663,5757,Nrm hooligan s where are you ???,Organic,
2664,5758,I regret not showing someone how much I loved them-Nasir Nasser https://bit.ly/3hHeO2D:=:https://www.monitor.co.ug/Magazines/Life/-Nasir-Nasser-Makerere-Digimination-Kim-Swagga/689856-5599212-n3ymm6z/index.html #MonitorUpdates,Editorial,
2665,5759,Explain EC sackings and ballot printing https://zionly.io/xeJwE10:=:https://www.monitor.co.ug/OpEd/Editorial/Explain-EC-sackings-and-ballot-printing/689360-5599470-12ccuu2/index.html #MonitorUpdates,Editorial,
2666,5760,hmmmm Maa Juli why? ah ah ah ❤️🔥❤️🔥,Organic,
2667,5761,Tell Mr President,Organic,
2668,5762,Tell Mr President,Organic,
2669,5763,"Museveni launches two books authored by PS Bigirimana The president also commended the PS Pius Bigirimana for, what he said, being an ""active civil servant and loyal cadre"" https://bit.ly/3jLhdvo:=:https://www.monitor.co.ug/News/National/Museveni-launches-two-books-authored-by-PS-Bigirimana/688334-5599544-l0kfhkz/index.html #MonitorUpdates",Editorial,
2670,5764,Otunda kaboozi oba ogula kaboozi? Join the right WhatsApp market group. ATUNDA AYOLESA.........,Organic,
2671,5765,Otunda kaboozi oba ogula kaboozi? Join the right WhatsApp market group. ATUNDA AYOLESA.........,Organic,
2672,5766,Inside Opposition meeting to field one candidate https://zionly.io/rq8Z30B:=:https://www.monitor.co.ug/Magazines/PeoplePower/Inside-Opposition-meeting-to-field-one-candidate/689844-5599334-wx9fhd/index.html #MonitorUpdates,Editorial,
2673,5767,streamlive and feel the action,Organic,
2674,5768,Very unprofessional presenter.,Organic,
2675,5769,I’m leaving Parliament to focus on farming – Wamanga-Wamai https://zionly.io/1LqkvYj:=:https://www.monitor.co.ug/Magazines/PeoplePower/I-m-leaving-Parliament-to-focus-on-farming---Wamanga-Wamai/689844-5599314-sn8mt7/index.html #MonitorUpdates,Editorial,
2676,5770,"Old rivalries renewed as Babu, Kigongo lock horns in NRM polls https://zionly.io/dynZh3a:=:https://www.monitor.co.ug/Magazines/PeoplePower/Old-rivalries-renewed-Babu-Kigongo-lock-horns-NRM-polls/689844-5599270-w3jvj1z/index.html #MonitorUpdates",Editorial,
2677,5771,"A team of Teso leaders joined by Ministry of Agriculture, Animal industry and fisheries officials have inspected the National Semi-Arid resources research institute in Serere. #NTVNews",Editorial,
2678,5772,Couple Breaks up on Roller Coaster Ride,Organic,
2679,5773,Ministry of Health Officials have confirmed second Coronavirus death as Uganda’s cases continue to rise. The deceased was an 80-year-old female who had been admitted to Mengo Hospital in Kampala https://bit.ly/39usbjT:=:https://www.monitor.co.ug/News/National/Uganda-confirms-second-Coronavirus-death/688334-5599514-yb998cz/index.html #MonitorUpdates,Editorial,
2680,5774,online Church Live,Organic,
2681,5775,"Dictator mu7 must fall gasiya ,no covid 19 in Uganda",Organic,
2682,5776,This regime!!!!!! That now they are counting COVID19 deaths!!!!!,Organic,
2683,5777,Covid-19 WHO chief advice.,Organic,
2684,5778,The National Resistance Movement (NRM)’s social media activists ( SOMA) national chairperson Lyvine Julius has quit the party.,Organic,
2685,5779,Excellent. Thank you for the brilliant message. I hope the artists of Uganda are listening. The Struggle Continues!,Organic,
2686,5780,"At least 12 families have been displaced without compensation by the ongoing road works in Busara village, Kitabu Sub-county in Kasese district. #NTVNews",Editorial,
2687,5781,Great music by Bobi Wine... Powerful message! The Struggle Continues!,Organic,
2688,5782,"VALUED AT A STAGGERING $12.9 BILLION, KAYIBANDA RUBATASIRWA MUSEVENI IS RWANDA'S ONLY BILLIONAIRE.",Organic,
2689,5783,https://www.facebook.com/KingOfsKitsQmok/videos/729941730912956/?app=fbl,Organic,
2690,5784,"Is this the same Anite who was crying tears that some NRM mafia wanted to kill her. What a confused lady, this Anita Minister!!!!!!! She will be used by Museveni and then ditched like TOILET PAPER... Like many others before her... HER VERY LOW REASONING CAPACITY MAKES ME WONDER HOW SUCH A PERSON CAN BE A SENIOR MINISTER IN ANY GOVERNMENT.... Pure primitive demagoguery! She thinks all Ugandans are that stupid not to see through her foolish gibberish. The Struggle Continues",Organic,
2691,5785,"Is this the same Anite who was crying tears that some NRM mafia wanted to kill her. What a confused lady, this Anita Minister!!!!!!! She will be used by Museveni and then ditched like TOILET PAPER... Like many others before her... HER VERY LOW REASONING CAPACITY MAKES ME WONDER HOW SUCH A PERSON CAN BE A SENIOR MINISTER IN ANY GOVERNMENT.... Pure primitive demagoguery! She thinks all Ugandans are that stupid not to see through her foolish gibberish. The Struggle Continues",Organic,
2692,5786,"North Korea declared its first suspected coronavirus case on Sunday, becoming one of the last countries to do so as the number of people infected worldwide passed 16 million. #NTVNews Here 👇👇",Editorial,
2693,5787,Enjoy Ugandan music,Organic,
2694,5790,Information Minister Judith Nabakooba has urged Boda Boda riders to follow the guidelines stipulated for the formal resumption of passenger services on Boda Bodas. #NTVNews,Editorial,
2695,5791,Christian Church Forcibly Converted To A MOSQUE By Fascist Turkish THUG Erdoğan Holds Its First Muslim Prayers,Organic,
2696,5792,Share until it reaches Museveni,Organic,
2697,5793,Kumbe Ni Muwooga Tupu,Organic,
2698,5794,Plot to kill minister: Case deferred as state investigates 8 suspects https://bit.ly/3g3qzA6:=:https://www.monitor.co.ug/News/National/Plot-kill-minister-State-asks-court-time-investigate-suspects/688334-5599378-rnjykg/index.html #MonitorUpdates,Editorial,
2699,5795,Kasese District must Shine....,Organic,
2700,5796,Is Bobi Wine on State House payroll indirectly now??? Excting,Organic,
2701,5797,"The Premier League's longest season is set for a dramatic finish on Sunday as Chelsea, Manchester United and Leicester battle for Champions League places, with a desperate scrap to avoid relegation at the bottom. #NTVNews Details here 👇👇",Editorial,
2702,5798,"WELCOME TO THE LEGAL JUNGLE OF PEOPLE POWER MISSION 2021 REVOLUTION: The Time For The Bush War Memories In The New Uganda Is Over. Yoweri Museveni And His ""National Robbery Movement"" Should Pack Their Belongings And Leave In Peace After 40 Years In Power Or They Will Leave By Force In Pieces. IT'S THE END GAME. IT'S A DO OR DIE GRAND FINALE. https://www.facebook.com/extrafactsug/videos/609149233128319/",Organic,
2703,5799,The Lango community in Diaspora has launched a post coronavirus recovery for the nine districts in Lango Sub-region. #NTVNews,Editorial,
2704,5800,"The Premier League's longest season is set for a dramatic finish on Sunday as Chelsea, Manchester United and Leicester battle for Champions League places, with a desperate scrap to avoid relegation at the bottom. https://bit.ly/2Bul5zk:=:https://www.newvision.co.ug/news/1523408/premier-league-braces-dramatic-final-day | #VisionSports",Editorial,
2705,5801,Hahahahh Ugandans 😂😂🙌🙌🙌🙌. #Enanga,Organic,
2706,5802,"REMEMBERING THE NORTHERN UGANDA HOLOCAUST. Soon after illegally conquering Uganda and establishing a Rwandan regime of occupation, blood soaked Rwandan killer Kayibanda Rubatarasirwa Museveni set about exterminating the people of Northern Uganda. Supported by henchmen like Tinyefunza, Mugisha Muntu, Severino Kahinda Otafire, Kale Kayihura, and quislings like Ofwono Opondo, Kayibanda embarked on a holocaust of unprecedented barbarity never seen on the African continent before and dwarfing the 1966-67 holocaust in Nigeria. For 20 years, Kayibanda corralled and imprisoned the people of Northern Uganda in dreadful concentration camps that NAZI Fuhrer Adolf Hitler would have been jealous of. The brutal and the cruel manner in which Kayibanda and his killer army set upon people they regarded as biological substances has never been repeated anywhere on earth. Rape of minors became routine, homosexual rape of men, some as old as 90 years, became a common occurrence. Human Rights Watch estimated that up to 1,000 Acholi were dying in these killer camps every week, yet the world sat by and watched. It is estimated that up to 1 million Acholi were killed by Kayibanda and his murderous merry band. This was also the first time on the African continent that a gang of heavily armed killers marched from their homeland in Rwanda, travelling thousands of miles, to murder people in a neighbouring country who had done them no harm, but had on the contrary provided them with refuge when they were fleeing genocide in their own country. Kayibanda and his murderous merry gang have since been trying to bury their blood soaked record. Employing bus boys like Julius Peter Moto, they issue out unending drivel in which they blame their victims for their suffering. But the fact remains that Kayibanda and his hired killers, including Ugandan quislings who aided and abetted his murderous rampages then and now, have never been punished. Some of them have taken off their uniforms and now hide as false messiahs in the general population. They have forgotten that blood spilled can never be erased. It is the duty of our generation to drag these killers and their quislings before the bar of justice and force them to account for their crimes, no matter how long it takes. Moses Atocon John Ojok-Akona Okello Lucima Opot KaIcaka Teddy Ayo Kimong Eveline Kim Norman Lakayana William Okidi Sokolokobangusay Kolongo Mary Onek Morris P'LORENG'A Paul Lam-Kilama Betty Segers",Organic,
2707,5803,Here is our new video. Click on the link and enjoy. Sorry for the delay but we will do better next time,Organic,
2708,5804,Church time,Organic,
